"0","Many of the functions in tidyverse packages, including those in `dplyr`,
provide exceptions to the general rule about quotation marks. Unfortunately,
this may make it a bit hard to learn when to use quotation marks. One way to
think about this, which is a bit of an oversimplification but can help as
you're learning, is to assume that anytime you're using a `dplyr` function,
every column in the dataframe you're working with has been loaded to your R
session as its own object, which means you don't need to use parentheses---most
of the time."
"2","don't know how to handle 'block' engine output"
